Account,Industry,HQ,Headcount,Funding,Total Open Roles,Relevant Roles,Funding Signal,Leadership Signal,Expansion Signal,Key Signals,Why Now,Source URL
Lovable,,"Stockholm, Sweden",~150,"Series B, $330M at $6.6B valuation, Dec 2025",13,3,1,0,1,"3 relevant open roles incl. Design Engineer (board contracted from 70 to 13 total; most prior product/growth/analytics roles closed) | Funding: Series B, $330M at $6.6B valuation, Dec 2025 | Expansion: Hit $500M ARR in June 2026, hiring across new SF, London and Boston offices","Hyper-growth vibe coding leader at $500M ARR; board contracted sharply this cycle but Design Engineer and related roles confirm product-led motion remains active.",https://lovable.dev/careers
LangChain,,"San Francisco, CA, USA (majority of roles SF/Bay Area, some remote)",~280,"Series B, $125M at $1.25B valuation, Oct 2025",10,0,1,0,1,"0 relevant open roles (LangSmith PM and Growth & Monetization eng reqs closed; Ashby board down to 10 total) | Funding: Series B, $125M at $1.25B valuation, Oct 2025 | Expansion: Shipped LangChain and LangGraph 1.0, Insights Agent, and no-code agent builder (Oct 2025)...","Product/growth reqs have closed this cycle; the fresh unicorn status and LangSmith product analytics platform remain strong longer-term signals. Monitor for next product/growth hiring wave.",https://langchain.com/blog/series-b
Linear,,"San Francisco, CA, USA (fully remote-first, distributed North America and Europe)",~210,,8,7,0,0,1,"7 relevant open roles incl. Senior/Staff Product Engineer (x4 EU + NA), Product Engineer, Product Manager (x2) | Expansion: Launched Linear Agent public beta (Mar 2026) and Diffs in-app code review (May 2026)...","The archetypal product engineer culture with 8 open product engineer and PM roles and a 2026 AI agent product push; last round (Series C $82M, Jun 2025, Accel) just predates the funding window",https://linear.app/changelog
Supabase,,"San Francisco, CA, USA (fully remote, staff in 35+ countries)",~350,"Series F, $500M at $10.5B valuation, Jun 2026",8,0,1,0,1,"0 relevant open roles (product/design/analytics reqs closed; Ashby board down to 8 total) | Funding: Series F, $500M at $10.5B valuation, Jun 2026 | Expansion: Valuation doubled to $10.5B in 8 months (Jun 2026); ~$170M ARR May 2026 per Sacra; database...","Two rounds in 8 months, war chest deployed into product surface area (Interfaces, Security, Infra PMs all open); a textbook example of the ICP",https://supabase.com/blog/supabase-series-e
ElevenLabs,,"New York, NY, USA (hubs in London and Warsaw)","~1,000","Series D, $500M at $11B valuation, Feb 2026",9,0,1,0,1,"0 relevant open roles (Full-Stack Growth Engineer and product reqs closed; Ashby board down to 9 total) | Funding: Series D, $500M at $11B valuation, Feb 2026 | Expansion: Crossed $500M ARR in May 2026, restructured around ElevenAgents / ElevenCreative / ElevenAPI...","Growth and product-analytics reqs have closed; $500M ARR and AI product restructuring remain strong longer-term signals. Monitor for next product/growth hire cycle.",https://elevenlabs.io/blog/series-d
Baseten,,"San Francisco, CA, USA",~280,"Series F, $1.5B at $13B valuation, Jun 2026",10,1,1,0,1,"1 relevant open role: Product Engineer - Dedicated Inference (PM and DevEx reqs closed; board down to 10 total) | Funding: Series F, $1.5B at $13B valuation, Jun 2026 | Expansion: 1B+ inference requests/day across 87 clusters on 18 clouds; ~20x YoY revenue growth; tripling...","Product Manager reqs closed; Product Engineer for Dedicated Inference remains open. June 2026 Series F and $13B valuation keep this a strong watch account; monitor for next PM or growth-engineering cycle.",https://jobs.ashbyhq.com/baseten
n8n,,"Berlin, Germany",~950,"Series C, $180M at $2.5B valuation, Oct 2025",5,2,1,0,1,"2 relevant open roles: AI Product Manager, Sr Growth Engineer (Fullstack TS/Vue/NodeJS) | Funding: Series C, $180M at $2.5B valuation, Oct 2025 | Expansion: Multi-year SAP deal embedding n8n in SAP Joule Studio (May 2026); 1,400+ enterprise customers...","Growth Engineer and Product Data Analyst are open right now, textbook product-analytics buyer roles; headcount estimate (950 via Revelio/Tracxn) is the biggest data caveat, other trackers show far lower",https://blog.n8n.io/series-c
Attio,,"London, UK (hybrid, also hiring US/remote)",~150,,12,6,0,0,1,"6 relevant open roles incl. Product Engineer, Senior Product Engineer [Backend], Staff Product Engineer | Expansion: Launched Ask Attio agentic AI assistant plus MCP server and web research agent (Feb 2026)...","Six open Product Engineer roles at every level; Series B ($52M, GV) closed Aug 26 2025, days outside the funding window, so the money is fresh even if unscored; employee count is a low confidence estimate (100-200)",https://attio.com/blog/attio-raises-52m-series-b
Render,,"San Francisco, CA, USA",~130,"Series C extension, $100M at $1.5B valuation, Feb 2026",6,1,1,0,1,"1 relevant open role: Software Engineer, Product (growth/design eng reqs closed; Ashby board down to 6 total) | Funding: Series C extension, $100M at $1.5B valuation, Feb 2026 | Expansion: 4.5M+ developers on platform, revenue growth above 100% YoY, positioning as the cloud for...",Fresh $100M and dedicated Product and Growth engineering reqs open across all levels; classic PLG infra company where engineers pick the analytics stack,https://jobs.ashbyhq.com/render
Gamma,,"San Francisco, CA, USA (strongly in-office)",~60,"Series B, $68M at $2.1B valuation, Nov 2025",13,0,1,0,1,"0 relevant open roles (Growth eng, AI Data Scientist reqs closed; Ashby board down to 13 total) | Funding: Series B, $68M at $2.1B valuation, Nov 2025 | Expansion: Surpassed $100M ARR with 70M users and 2+ years of profitability (Nov 2025); shipped Gamma 3.0...",$100M ARR with about 60 people is extreme PLG efficiency; a named Growth engineer opening plus AI Data Scientist means experimentation tooling decisions are live,https://jobs.ashbyhq.com/gamma
Granola,,"London, UK (engineering in London, GTM in San Francisco)",~60,"Series C, $125M at $1.5B valuation, Mar 2026",13,5,1,0,1,"5 relevant open roles incl. Product Engineer (Full Stack), Product Engineer (Windows), Product Engineer (Backend), Design Engineer, Product Engineer (Transcription) | Funding: Series C, $125M at $1.5B valuation, Mar 2026 | Expansion: Enterprise push: launched Spaces, admin APIs and MCP server; enterprise customers include...",Every open engineering role is literally titled Product Engineer; fresh Series C funding an enterprise expansion where usage analytics becomes a board metric,https://jobs.ashbyhq.com/granola
Braintrust,,"San Francisco, CA, USA",~100,"Series B, $80M at $800M valuation, Feb 2026",16,2,1,0,1,"2 relevant open roles: Software Engineer Product, Design Engineer (PLG PM and Data Engineer reqs closed) | Funding: Series B, $80M at $800M valuation, Feb 2026 | Expansion: Expanding from evals into full AI observability layer (Brainstore database), growing eng and...","Hiring a Product Manager, PLG is as loud a buying signal as it gets for product analytics; fresh Series B and geographic expansion compound it",https://braintrust.dev/blog/announcing-series-b
Vapi,,"San Francisco, CA, USA",~100,"Series B, $50M at ~$500M valuation, May 2026",10,2,1,0,1,"2 relevant open roles incl. Member of Technical Staff, Product, Member of Technical Staff, Backend | Funding: Series B, $50M at ~$500M valuation, May 2026 | Expansion: Won Amazon Ring over 40 rivals; Ring routes 100% of inbound calls through Vapi; crossed 1...",Fresh Series B plus a marquee enterprise win means usage is exploding; product focused technical staff hires suggest the team instruments as it scales,https://vapi.ai/blog/series-b
Mintlify,,"San Francisco, CA, USA",~65,"Series B, $45M at $500M valuation, Apr 2026",11,2,1,0,1,"2 relevant open roles incl. Product Engineer, Senior Product Engineer | Funding: Series B, $45M at $500M valuation, Apr 2026 | Expansion: Docs platform for 20,000+ companies incl. Anthropic; ~$10M ARR end of 2025 (10x YoY); pivoting...","Just raised, 10x ARR growth, and both open engineering roles are Product Engineer titles; small enough that one champion converts the whole stack",https://mintlify.com/blog/series-b
Railway,,"San Francisco, CA, USA (remote-first, ~35 people globally)",~35,"Series B, $100M, Jan 2026",7,1,1,0,1,"1 relevant open role: Product Designer (senior product eng reqs closed; board down to 7 total) | Funding: Series B, $100M, Jan 2026 | Expansion: 2M+ developers, 10M+ deployments/month, 31% of Fortune 500 using platform; expanding global...",$100M landing on a ~35 person team means tooling budgets just unlocked; first GTM org buildout is exactly when product analytics gets bought,https://blog.railway.com/p/series-b
Hex,,"San Francisco, CA, USA (with New York office and remote presence)",~150,,27,4,0,0,1,"4 relevant open roles incl. Product Manager, Senior Product Manager, Senior Product Manager Growth, Software Engineer Growth & Monetization | Expansion: Fall 2025 launch introduced the Notebook Agent and team-focused agentic analytics, extending...","Growth and Monetization engineering plus two PM openings; Series C ($70M, Avra) was May 2025, just outside the window, but the agentic pivot keeps momentum current",https://hex.tech/blog/fall-2025-launch
Clerk,,"San Francisco, CA, USA (fully remote, global team)",~150,"Series C, $50M, Oct 2025",0,0,1,0,1,"Funding: Series C, $50M, Oct 2025 | Expansion: Agent Identity push post Series C; 2026 GA releases incl. Android SDK GA, SCIM Directory Sync...",Strong ICP fit and a fresh war chest but zero open roles (confirmed via Ashby API); the interesting Watch story is catching the hiring restart the moment Agent Identity scales,https://clerk.com/careers
Resend,,"San Francisco, CA, USA (remote-first, async team)",~35,,12,2,0,0,1,2 relevant open roles incl. Product Engineer | Expansion: Hit 1 million users about 30 months after launch (Dec 2025); acquired Briefer in Aug 2025; ARR...,"Two Product Engineer openings on a ~35 person team and 1M users; last round is a Dec 2024 Series A (a16z) so budget may be tighter, but developer-first DNA is a perfect ICP match",https://resend.com/blog/series-a
Warp,,"New York, NY, USA (remote-first US and Canada)",~78,,2,1,0,0,1,"1 relevant open roles incl. Software Engineer (Remote, US and Canada) | Expansion: Pivoted to Agentic Development Environment (Warp 2.0, Jun 2025), open-sourced the ADE, named a...",ADE pivot has real traction but hiring is minimal (2 total openings) and last funding was Jun 2023; monitor for a raise or hiring wave before investing outreach time,https://job-boards.greenhouse.io/warp
Raycast,,"London, UK (remote-first)",~45,,0,0,0,0,1,Expansion: Raycast 2.0 public beta launched May 2026 with Windows support and built-in AI,"Windows expansion doubles the addressable user base overnight, which eventually forces analytics questions; but no open roles and no fresh funding (last round Sep 2024), so watch only",https://raycast.com/careers
